oid,name,repeating,sdtm_version,translated_texts,aliases
F.DM,Informed Consent and Demography,No,,"Description::en::Informed Consent and Demography form||osb:CompletionInstructions::en::Please complete this Informed Consent and Demography form at the very beginning of the study

General item design notes:
Integration: A: Argus, Ax: Forms attached in Argus, C: CPR Dashboard, IW: IWRS, P: Impact, R: Reports, RT: RTSM

General item design notes:  Integration: A: Argus, Ax: 

rms attached in Argus, C: CPR Dashboard, IW: IWRS, P: Impact, R: Reports, RT: RTSM

Oracle item des
N notes:  Key: [*] = Item is required.  Sex: Populated by IWRS. Item to trigger Childbearing potential form to appear if response = Female.  Subject No.: Populated by IWRS and mapped from ENR to Inf Cons/DemogOracle item design notes:  Key: [*] = Item is required.  Sex: Populated by IWRS. Item to trigger Childbearing potential form to appear if response = Female.  Subject No.: Populated by IWRS and mapped from ENR to Inf Cons/Demog",
F.VS,Vital Signs,No,,"Description::en::Vital signs form||osb:CompletionInstructions::en::Please complete this Vital Sign form before starting the treatment",
F.MH,Medical History/Concomitant Illness,No,,"Description::en::Medical History/Concomitant Illness (Without pre-printed diagnosis)||osb:CompletionInstructions::en::This CRF is to be used for studies not collecting specific medical histories (e.g. Cardiovascular History, Diabetes History, Gallbladder Disease History).",
F.IM,Administration of <Investigational medicinal product>,No,,"Description::en::Administration of <Investigational medicinal product>||osb:CompletionInstructions::en::In case of multiple investigational medicinal products, there should be separate CRFs for each, unless the study in blinded.
In case the study is blinded, the investigational  medical product should be named with combination of the drugs with a '/' between the names.
The items: Dose form and Route do not need to be visible for investigator if only one response is used, but values must be available in the data loaded.
If stop date is not collected, copy start date (ECSTDTC) to stop date (ECENDTC). This could be cases for administrations considered given at a point in time (e.g., oral  tablet, pre-filled syringe injection).
Either Prescribed dose or Actual dose has to be collected together with the Start date. 
This form is a maximum content form and no additional questions and/or response options can be added unless evaluated E2E by IG and approved by the PST.",
F.AE,Adverse Event,No,,"Description::en::Adverse Event||osb:CompletionInstructions::en::One AE should be reported per form.,
During conduct of the study, please transcribe data to EDC as soon as possible.
The AE diagnosis, causality, seriousness and severity should be evaluated by the investigator or sub-investigator with physician background.",
F.EG,ECG,No,,"Description::en::ECG form||osb:CompletionInstructions::en::Please complete this ECG form before starting the treatment",